fid,nazwa,url,opis,full,ourl
"1","Agens.pl","https://mambiznes.pl/startupy/agens-pl-77454","Agens.pl jest to autorska platforma do wsparcia sprzedaży ubezpieczeń. Obecnie w zakresie usług…",=hyperlink("http://fubar.pl/test/startupy/1.html","1.html"),""
"2","Bike Service","https://mambiznes.pl/startupy/bike-service-77412","Aplikacja Bike Service umożliwia użytkownikowi bez wychodzenia z domu znaleźć punkt serwisowy, zobaczyć…",=hyperlink("http://fubar.pl/test/startupy/2.html","2.html"),""
"3","Znajdzlunch.pl","https://mambiznes.pl/startupy/znajdzlunch-pl-2-77254","Znajdzlunch.pl jest to wyszukiwarka ofert lunchowych na terenie Poznania. Dzięki niej nie trzeba…",=hyperlink("http://fubar.pl/test/startupy/3.html","3.html"),""
"4","CebulaDeals.com","https://mambiznes.pl/startupy/cebuladeals-com-77386","CebulaDeals.com to strona, która automatycznie wyszukuje promocje w sklepach internetowych. Na początku monitorowaliśmy…",=hyperlink("http://fubar.pl/test/startupy/4.html","4.html"),""
"5","Terra Run","https://mambiznes.pl/startupy/terra-run-77299","TerraRun jest aplikacją mobilną, dzięki której zagramy we wcześniej przygotowaną grę terenową, w…",=hyperlink("http://fubar.pl/test/startupy/5.html","5.html"),""
"6","CreativeStudio","https://mambiznes.pl/startupy/creativestudio-76541","Zajmujemy się kompleksową produkcją filmową. Badamy wpływ filmu na decyzje zakupowe konsumenta. Od…",=hyperlink("http://fubar.pl/test/startupy/6.html","6.html"),""
"7","Urlopy.co","https://mambiznes.pl/startupy/urlopy-co-76926","Aplikacja Urlopy.co to narzędzie do prostego rozliczania urlopów w małych firmach. Pozwala na…",=hyperlink("http://fubar.pl/test/startupy/7.html","7.html"),""
"8","Szpiegomat","https://mambiznes.pl/startupy/szpiegomat-76578","Stworzyliśmy narzędzie price intelligence do monitoringu cen w internecie dla producentów i sprzedawców…",=hyperlink("http://fubar.pl/test/startupy/8.html","8.html"),""
"9","Vegetime","https://mambiznes.pl/startupy/vegetime-76730","Vegetime.pl to wyszukiwarka restauracji oferujących posiłki dla wegetarian i wegan. Jest nastawiona nie…",=hyperlink("http://fubar.pl/test/startupy/9.html","9.html"),""
"10","TeleCube.pl","https://mambiznes.pl/startupy/telecube-pl-76697","TeleCube.pl to marka telefonii internetowej (VoIP), szczególny nacisk jednak kładziemy na rozwój usługi…",=hyperlink("http://fubar.pl/test/startupy/10.html","10.html"),""
"11","Cluify","https://mambiznes.pl/startupy/cluify-76608","Cluify umożliwia pozyskiwanie nowych klientów poprzez tworzenie reklam online do osób, które odwiedziły…",=hyperlink("http://fubar.pl/test/startupy/11.html","11.html"),""
"12","FUNCMEAL SUPERFOODS DRINK","https://mambiznes.pl/startupy/funcmeal-superfoods-drink-76208","Funcmeal Superfoods Drink to naturalny i w pełni roślinny koktajl energetyczny do zalania…",=hyperlink("http://fubar.pl/test/startupy/12.html","12.html"),""
"13","Wynajme.pl","https://mambiznes.pl/startupy/wynajme-pl-76191","Funkcjonujący portal ogłoszeniowy. Jesteśmy na etapie pozyskiwania wypożyczalni i wprowadzania produktów. Aktualnie na…",=hyperlink("http://fubar.pl/test/startupy/13.html","13.html"),""
"14","SWAY.TO","https://mambiznes.pl/startupy/sway-to-76486","Rozwijamy SWAY.TO – interaktywny planer turystyczny dzięki któremu każdy może w wygodny sposób…",=hyperlink("http://fubar.pl/test/startupy/14.html","14.html"),""
"15","Bunny United","https://mambiznes.pl/startupy/bunny-united-76355","Oferujemy usługę stworzenia działu marketingu na zasadzie klocków lego. Budujemy zespół na podstawie…",=hyperlink("http://fubar.pl/test/startupy/15.html","15.html"),""
"16","Portal MMO","https://mambiznes.pl/startupy/portal-mmo-76256","Portal MMO to serwis multimedialny z grami internetowymi skierowany do graczy komputerowych zainteresowanych…",=hyperlink("http://fubar.pl/test/startupy/16.html","16.html"),""
"17","Kadromierz","https://mambiznes.pl/startupy/kadromierz-76177","Kadromierz to platforma do zarządzania czasem pracy online, która usprawnia procesy planowania, kontroli…",=hyperlink("http://fubar.pl/test/startupy/17.html","17.html"),""
"18","UserEngage","https://mambiznes.pl/startupy/userengage-76070","UserEngage to narzędzie do marketingu internetowego które pozwala zrozumieć intencję odwiedzającego witrynę i…",=hyperlink("http://fubar.pl/test/startupy/18.html","18.html"),""
"19","Guides4Art","https://mambiznes.pl/startupy/guides4art-76084","Guides4Art to interaktywna platforma połączona z aplikacją mobilną o tej samej nazwie, którą…",=hyperlink("http://fubar.pl/test/startupy/19.html","19.html"),""
"20","Żegluj","https://mambiznes.pl/startupy/zegluj-76038","Jest to aplikacja mobilna Żegluj. Na tę chwilę powstała pierwsza wersja na jeden…",=hyperlink("http://fubar.pl/test/startupy/20.html","20.html"),""
"21","Timepot","https://mambiznes.pl/startupy/timepot-76024","Timepot jest aplikacją do monitorowania czasu pracy, urlopów i finansów firmy. Daje dostęp…",=hyperlink("http://fubar.pl/test/startupy/21.html","21.html"),""
"22","Sprawdz.biz","https://mambiznes.pl/startupy/sprawdz-biz-75867","Rozwijamy całkowicie darmową wyszukiwarkę umożliwiającą sprawdzenie danego podmiotu pod kątem jego wiarygodności finansowej.…",=hyperlink("http://fubar.pl/test/startupy/22.html","22.html"),""
"23","Alsel.pl","https://mambiznes.pl/startupy/alsel-pl-75758","Projekt alsel.pl jest prostym w obłudzie kreatorem stron. Projekt został wypuszczony na światło…",=hyperlink("http://fubar.pl/test/startupy/23.html","23.html"),""
"24","SportCalendar.pl","https://mambiznes.pl/startupy/sportcalendar-pl-75614","Na obecnym etapie portal jest kalendarzem wydarzeń sportowych. Każdy organizator może za darmo…",=hyperlink("http://fubar.pl/test/startupy/24.html","24.html"),""
"25","mfind.pl","https://mambiznes.pl/startupy/mfind-pl-75605","Projekt mfind obejmuje bezpłatną, najdokładniejszą na rynku porównywarkę/kalkulator online ubezpieczeń komunikacyjnych, nieruchomości, zdrowotnych…",=hyperlink("http://fubar.pl/test/startupy/25.html","25.html"),""
"26","TG Wulkan mobilny serwis opon","https://mambiznes.pl/startupy/tg-wulkan-mobilny-serwis-opon-75382","TG Wulkan mobilny serwis opon to jak sama nazwa wskazuje mobilny warsztat wulkanizacyjny.…",=hyperlink("http://fubar.pl/test/startupy/26.html","26.html"),""
"27","EPICVR","https://mambiznes.pl/startupy/epicvr-75401","Tworzymy filmy 360 oraz aplikacje VR, które nasi klienci wykorzystują do tworzenia skutecznych,…",=hyperlink("http://fubar.pl/test/startupy/27.html","27.html"),""
"28","Kartonado","https://mambiznes.pl/startupy/kartonado-75385","Kartonado to marketplace łączący osoby, które potrzebują miejsca do przechowywania swoich rzeczy z…",=hyperlink("http://fubar.pl/test/startupy/28.html","28.html"),""
"29","MyPlacimy.pl","https://mambiznes.pl/startupy/myplacimy-pl-75327","Usługa My Płacimy to odroczony termin płatności dla mikro i małych przedsiębiorców na…",=hyperlink("http://fubar.pl/test/startupy/29.html","29.html"),""
"30","BUKI","https://mambiznes.pl/startupy/buki-75208","Zaczęliśmy projekt 3 lata temu. Dołączyło do nas do tej pory ponad 10…",=hyperlink("http://fubar.pl/test/startupy/30.html","30.html"),""
"31","Taxly.pl","https://mambiznes.pl/startupy/taxly-pl-75137","Jesteśmy na etapie rozwoju już funkcjonującego produktu. Nasz startup oferuje prowadzenie księgowości a także…",=hyperlink("http://fubar.pl/test/startupy/31.html","31.html"),""
"32","Znajdzlunch.pl","https://mambiznes.pl/startupy/znajdzlunch-pl-75120","Strona znajdzlunch.pl to wyszukiwarka aktualnych ofert lunchowych w restauracjach. Obecnie strona wyszukuje lunche…",=hyperlink("http://fubar.pl/test/startupy/32.html","32.html"),""
"33","BIONIGREE","https://mambiznes.pl/startupy/bionigree-75083","BIONIGREE to pierwszy polski producent naturalnych kosmetyków trychologicznych z czarną porzeczką. Spółka powstała…",=hyperlink("http://fubar.pl/test/startupy/33.html","33.html"),""
"34","e-Sensor.pl","https://mambiznes.pl/startupy/e-sensor-pl-75021","Rozwijamy projekt czujników WiFi z monitoringiem online i powiadamianiem e-mail oraz sms. Np.…",=hyperlink("http://fubar.pl/test/startupy/34.html","34.html"),""
"35","Vindicat.pl","https://mambiznes.pl/startupy/vindicat-pl-75006","Projekt Vindicat.pl to gotowy dla przedsiębiorców system do samodzielnej windykacji online, który umożliwia…",=hyperlink("http://fubar.pl/test/startupy/35.html","35.html"),""
"36","Swipx.com","https://mambiznes.pl/startupy/swipx-com-74849","swipx to platforma łącząca producentów oprogramowania komputerowego z firmami poszukującymi właściwego rozwiązania. Firma…",=hyperlink("http://fubar.pl/test/startupy/36.html","36.html"),""
"37","Garden Box","https://mambiznes.pl/startupy/garden-box-74742","Garden Box to nowoczesny sposób zakładania ogrodu w oparciu o gotowe moduły. Każdy…",=hyperlink("http://fubar.pl/test/startupy/37.html","37.html"),""
"38","MojEkspert.pl","https://mambiznes.pl/startupy/mojekspert-pl-74750","Projekt jest na etapie wprowadzania na rynek. Na ten moment choć wygląda on bardzo…",=hyperlink("http://fubar.pl/test/startupy/38.html","38.html"),""
"39","Dodaje.pl","https://mambiznes.pl/startupy/dodaje-pl-74662","Funkcjonujący portal ogłoszeniowy. W planach wdrażanie nowych innowacyjnych rozwiązań dla sprzedaży. Skąd pomysł:…",=hyperlink("http://fubar.pl/test/startupy/39.html","39.html"),""
"40","eDobromir.pl","https://mambiznes.pl/startupy/edobromir-pl-74665","Rozwijamy projekt strony agregującej treści dla wszelkiej maści poradników oraz przełomowych koncepcji. Z…",=hyperlink("http://fubar.pl/test/startupy/40.html","40.html"),""
"41","Posprzatajmi.pl","https://mambiznes.pl/startupy/posprzatajmi-pl-74592","Wchodzisz na portal posprzatajmi.pl, podajesz kilka niezbędnych informacji takich jak: Twoje miasto, dzielnica,…",=hyperlink("http://fubar.pl/test/startupy/41.html","41.html"),""
"42","UlotkaZdrowia.pl","https://mambiznes.pl/startupy/ulotkazdrowia-pl-74536","Rozwijamy projekt UlotkaZdrowia.pl jesteśmy na etapie tworzenia i wprowadzania treści. Tworzymy unikalne opisy…",=hyperlink("http://fubar.pl/test/startupy/42.html","42.html"),""
"43","Kodilla.com","https://mambiznes.pl/startupy/kodilla-com-74482","To szkoła programowania online Kodilla.com, która z powodzeniem funkcjonuje od grudnia 2015 r.…",=hyperlink("http://fubar.pl/test/startupy/43.html","43.html"),""
"44",".BespokeChat","https://mambiznes.pl/startupy/bespokechat-74250",".BespokeChat to zespół zajmujący się outsourcingową obsługą czatów. Zajmujemy się obsługą tekstowego narzędzie…",=hyperlink("http://fubar.pl/test/startupy/44.html","44.html"),""
"45","Skillveo.pl","https://mambiznes.pl/startupy/skillveo-pl-74245","Skillveo to marketplace dla wiedzy eksperckiej i szkoleń sprzedawany w kanale B2B. Oferujemy…",=hyperlink("http://fubar.pl/test/startupy/45.html","45.html"),""
"46","Yawp.me","https://mambiznes.pl/startupy/yawp-me-74106","Yawp jest aplikacją bazującą na geolokalizacji, wykorzystującą sztuczną inteligencję w celu ułatwiania komunikacji…",=hyperlink("http://fubar.pl/test/startupy/46.html","46.html"),""
"47","Pokazon.pl","https://mambiznes.pl/startupy/pokazon-pl-74072","POKAZON to portal społecznościowy z kamerkami na żywo, umożliwiający przeprowadzanie płatnych pokazów o…",=hyperlink("http://fubar.pl/test/startupy/47.html","47.html"),""
"48","LINK2BUY.IT","https://mambiznes.pl/startupy/link2buy-it-73942","Jesteśmy firmą technologiczno-handlową, która tworzy aplikację wspierające sprzedaż, analitykę i promowanie marek na…",=hyperlink("http://fubar.pl/test/startupy/48.html","48.html"),""
"49","TurboEgg.com","https://mambiznes.pl/startupy/turboegg-com-73802","Tworzymy inteligentne produkty z kategorii Internet of Things w technologii Bluetooth Smart wraz…",=hyperlink("http://fubar.pl/test/startupy/49.html","49.html"),""
"50","OgarniamPrad.pl","https://mambiznes.pl/startupy/ogarniamprad-pl-72823","Ogarniamprad.pl to pierwsza w Polsce platforma aukcyjna do grupowych i profilowych zakupów prądu…",=hyperlink("http://fubar.pl/test/startupy/50.html","50.html"),""
"51","iFucha.pl","https://mambiznes.pl/startupy/ifucha-pl-73688","Serwis, który łączy ludzi zainteresowanych pracą dorywczą. Powstał z myślą o osobach pracujących,…",=hyperlink("http://fubar.pl/test/startupy/51.html","51.html"),""
"52","Ping.pl","https://mambiznes.pl/startupy/ping-pl-73133"," Projekt przeznaczony jest do monitoringu stron i serwisów internetowych. Regularnie sprawdzamy strony naszych…",=hyperlink("http://fubar.pl/test/startupy/52.html","52.html"),""
"53","Stapler.pl","https://mambiznes.pl/startupy/stapler-pl-73093","Rozwijamy portal kariery, który pokazuje najlepszych pracodawców w Polsce. Wierzymy, że ludzie nie…",=hyperlink("http://fubar.pl/test/startupy/53.html","53.html"),""
"54","IniJOB.pl","https://mambiznes.pl/startupy/inijob-pl-72803","IniJOB.pl to portal, którego celem jest znaczące poprawienie relacji pomiędzy pracownikiem a pracodawcą.…",=hyperlink("http://fubar.pl/test/startupy/54.html","54.html"),""
"55","eDoktor24.pl","https://mambiznes.pl/startupy/edoktor24-pl-72766","eDoktor24.pl to pierwsza w Polsce przychodnia internetowa. Jesteśmy podmiotem leczniczym świadczącym zdalnie konsultacje…",=hyperlink("http://fubar.pl/test/startupy/55.html","55.html"),""
"56","ForexRev.pl","https://mambiznes.pl/startupy/forexrev-pl-72789","Startup jest portalem zbierającym opinie i informacje na temat brokerów CFD/Forex. Portal obecnie…",=hyperlink("http://fubar.pl/test/startupy/56.html","56.html"),""
"57","PaczkaSupli.pl","https://mambiznes.pl/startupy/paczkasupli-pl-72784","Platforma Paczkasupli.pl skierowana jest dla osób aktywnych fizycznie, potrzebujących wsparcia w doborze suplementacji…",=hyperlink("http://fubar.pl/test/startupy/57.html","57.html"),""
"58","Carly.pl","https://mambiznes.pl/startupy/carly-pl-72778","Stworzyliśmy Carly.pl by pomóc osobom szukającym nowego samochodu w uzyskaniu najlepszej oferty. Dzięki…",=hyperlink("http://fubar.pl/test/startupy/58.html","58.html"),""
"59","Takeandbuy.pl","https://mambiznes.pl/startupy/takeandbuy-pl-10102","Take&buy.pl to nowa na polskim rynku aplikacja ze zniżkami. Użytkownik otrzymuje dzięki niej…",=hyperlink("http://fubar.pl/test/startupy/59.html","59.html"),""
"60","Szukam-trenera.pl","https://mambiznes.pl/startupy/szukam-trenera-pl-10101","Misją portalu Szukam-trenera.pl jest popularyzacja sportu poprzez ułatwienie dostępu do informacji o sportach…",=hyperlink("http://fubar.pl/test/startupy/60.html","60.html"),""
"61","Doszkalaj.pl","https://mambiznes.pl/startupy/doszkalaj-pl-10099","Zamiarem powstania portalu Doszkalaj.pl było wykreowanie miejsca w internecie, w którym użytkownik natychmiastowo…",=hyperlink("http://fubar.pl/test/startupy/61.html","61.html"),""
"62","GdziePoLek.pl","https://mambiznes.pl/startupy/gdziepolek-pl-10098","GdziePoLek.pl to internetowa wyszukiwarka dostępności i cen leków w aptekach stacjonarnych. Naszym celem…",=hyperlink("http://fubar.pl/test/startupy/62.html","62.html"),""
"63","Krypty.net","https://mambiznes.pl/startupy/krypty-net-10097","Krypty.net to porównywarka kursów krypto walut. Serwis ma zadanie dostarczać użytkownikom aktualnych i rzetelnych…",=hyperlink("http://fubar.pl/test/startupy/63.html","63.html"),""
"64","SklejBiznes.pl","https://mambiznes.pl/startupy/sklejbiznes-pl-10096","Sklejbiznes.pl stawia sobie za zadanie „sklejanie biznesów”. Dzięki funkcjom zawartym w serwisie takim…",=hyperlink("http://fubar.pl/test/startupy/64.html","64.html"),""
"65","Klikmapa.pl","https://mambiznes.pl/startupy/klikmapa-pl-10095","Klikmapa.pl jest serwisem pozwalającym na wyszukiwanie ogłoszeń nieruchomości w całej Polsce. Działanie systemu…",=hyperlink("http://fubar.pl/test/startupy/65.html","65.html"),""
"66","Jopillo.com","https://mambiznes.pl/startupy/jopillo-com-10094","Kreatywny serwis, umożliwiający prezentowanie, sprzedawanie i kupowanie usług lub dzieł.  Serwis promuje utalentowanych,…",=hyperlink("http://fubar.pl/test/startupy/66.html","66.html"),""
"67","Affmarketing.pl","https://mambiznes.pl/startupy/affmarketing-pl-10093","Affmarketing.pl to portal o marketingu afiliacyjnym. Jego głównym celem jest zrzeszenie osób zarabiających…",=hyperlink("http://fubar.pl/test/startupy/67.html","67.html"),""
"68","Okazjoner.pl","https://mambiznes.pl/startupy/okazjoner-pl-10092","Okazjoner.pl to platforma która monitoruje cenę produktu na dowolnej stronie i informuje użytkownika…",=hyperlink("http://fubar.pl/test/startupy/68.html","68.html"),""
"69","Allewarsztaty.pl","https://mambiznes.pl/startupy/allewarsztaty-pl-10091","Platforma zleceniowa Allewarsztaty.pl powstała, by pomagać właścicielom samochodów w znalezieniu solidnego i taniego…",=hyperlink("http://fubar.pl/test/startupy/69.html","69.html"),""
"70","Projo.pl","https://mambiznes.pl/startupy/projo-pl-10090","Projo.pl to platforma z gotowymi projektami wnętrz. Użytkownicy mogą za pośrednictwem strony kupić…",=hyperlink("http://fubar.pl/test/startupy/70.html","70.html"),""
"71","SwiatPrzychodni.pl","https://mambiznes.pl/startupy/swiatprzychodni-pl-10089","SwiatPrzychodni.pl jest serwisem internetowym dedykowanym polskiej służbie zdrowia. W portalu znajdują się informacje…",=hyperlink("http://fubar.pl/test/startupy/71.html","71.html"),""
"72","PoznajGwiazde.pl","https://mambiznes.pl/startupy/poznajgwiazde-pl-10088","PoznajGwiazde.pl to miejsce w Internecie, poprzez które można spełnić swoje marzenia i spotkać się…",=hyperlink("http://fubar.pl/test/startupy/72.html","72.html"),""
"73","Eduranking.pl","https://mambiznes.pl/startupy/eduranking-pl-10087","Eduranking.pl jest nowo powstałym portalem internetowym skierowanym głównie do rodziców dzieci w wieku…",=hyperlink("http://fubar.pl/test/startupy/73.html","73.html"),""
"74","SEOKitten.pl","https://mambiznes.pl/startupy/seokitten-pl-10086","SEOKitten.pl jest bezpłatnym narzędziem wspomagającym analizę witryn pod względem ich obecności w wyszukiwarkach,…",=hyperlink("http://fubar.pl/test/startupy/74.html","74.html"),""
"75","KradzionyTelefon.pl","https://mambiznes.pl/startupy/kradzionytelefon-pl-10085","KradzionyTelefon.pl jest internetową bazą skradzonych telefonów komórkowych. Dzięki witrynie użytkownik może bezpłatnie sprawdzić…",=hyperlink("http://fubar.pl/test/startupy/75.html","75.html"),""
"76","OcenPozyczke.pl","https://mambiznes.pl/startupy/ocenpozyczke-pl-10084","OcenPozyczke.pl to serwis umożliwiający ocenę firm pożyczkowych w jednej z 4 kategorii: obsługa klienta,…",=hyperlink("http://fubar.pl/test/startupy/76.html","76.html"),""
"77","PobiteGary.pl","https://mambiznes.pl/startupy/pobitegary-pl-10083","PobiteGary.pl to agregator fanpage’y z kategorii Restaurant/Cafe na FB. Restauracje obecne na Facebooku…",=hyperlink("http://fubar.pl/test/startupy/77.html","77.html"),""
"78","NightNavi.pl","https://mambiznes.pl/startupy/nightnavi-pl-10082","NightNavi.pl to aplikacja pozwalająca użytkownikowi znalezienie najbliższego sklepu nocnego. Narzędzie działa na iphonach…",=hyperlink("http://fubar.pl/test/startupy/78.html","78.html"),""
"79","Mecze.com","https://mambiznes.pl/startupy/mecze-com-10081","Internet jest przepełniony stronami, które oferują przekazy sportowe na żywo. Jednak wiele osób…",=hyperlink("http://fubar.pl/test/startupy/79.html","79.html"),""
"80","Zrzutka.pl","https://mambiznes.pl/startupy/zrzutka-pl-10080","Zrzutka.pl to portal umożliwiający zbieranie środków pieniężnych online. Start-up zrzutka.pl powstał we Wrocławiu…",=hyperlink("http://fubar.pl/test/startupy/80.html","80.html"),""
"81","Eduexplorer.pl","https://mambiznes.pl/startupy/eduexplorer-pl-10079","EduExplorer.pl jest serwisem pomagającym użytkownikom znaleźć najlepszych nauczycieli i umożliwia im umówienie się…",=hyperlink("http://fubar.pl/test/startupy/81.html","81.html"),""
"82","Zleceniobiorca.pl","https://mambiznes.pl/startupy/zleceniobiorca-pl-10078","Celem projektu Zleceniobiorca.pl jest pomoc przedsiębiorcom w pozyskiwaniu zleceń na usługi, które oferują…",=hyperlink("http://fubar.pl/test/startupy/82.html","82.html"),""
"83","Drafteye.com","https://mambiznes.pl/startupy/drafteye-com-10077","DraftEYE.com to system zarządzania projektami graficznymi i wspomagania komunikacji na linii grafik –…",=hyperlink("http://fubar.pl/test/startupy/83.html","83.html"),""
"84","Motokraft.pl","https://mambiznes.pl/startupy/motokraft-pl-10076","Motokraft.pl to projekt przeznaczony zarówno dla warsztatów jak i właścicieli samochodów. Dla tych…",=hyperlink("http://fubar.pl/test/startupy/84.html","84.html"),""
"85","NaKlate.pl","https://mambiznes.pl/startupy/naklate-pl-10075","NaKlate.pl  jest interaktywną platformą, która pozwala stworzyć i zamówić koszulkę z wybraną przez…",=hyperlink("http://fubar.pl/test/startupy/85.html","85.html"),""
"86","CandleScanner.pl","https://mambiznes.pl/startupy/candlescanner-pl-10074","CandleScanner.pl jest aplikacją przeznaczoną dla osób zainteresowanych analizą techniczną rynków finansowych. Projekt skierowany…",=hyperlink("http://fubar.pl/test/startupy/86.html","86.html"),""
"87","GdzieObejrze.pl","https://mambiznes.pl/startupy/gdzieobejrze-pl-10073","W sieci pojawił się nowy projekt GdzieObejrze.pl, którego celem jest połączenie sklepów internetowych…",=hyperlink("http://fubar.pl/test/startupy/87.html","87.html"),""
"88","Libredocs.pl","https://mambiznes.pl/startupy/libredocs-pl-10072","LibreDocs.pl to narzędzie, które pozwala on-line przygotować dokumenty związane z prowadzeniem działalności gospodarczej,…",=hyperlink("http://fubar.pl/test/startupy/88.html","88.html"),""
"89","PlacRachunki.pl","https://mambiznes.pl/startupy/placrachunki-pl-10071","PlacRachunki.pl to projekt umożliwiający gromadzenie rachunków i faktur i dokonywanie płatności on-line bezpośrednio…",=hyperlink("http://fubar.pl/test/startupy/89.html","89.html"),""
"90","PageLiker.pl","https://mambiznes.pl/startupy/pageliker-pl-10070","PageLiker.pl to witryna dla użytkowników korzystających z najpopularniejszego serwisu społecznościowego na świecie. U…",=hyperlink("http://fubar.pl/test/startupy/90.html","90.html"),""
"91","Fessor.pl","https://mambiznes.pl/startupy/fessor-pl-10069","Fessor.pl nowa platforma internetowa dla nauczycieli i wykładowców akademickich .Serwis oferuje narzędzia pozwalające użytkownikowi…",=hyperlink("http://fubar.pl/test/startupy/91.html","91.html"),""
"92","BankFaktur.pl","https://mambiznes.pl/startupy/bankfaktur-pl-10068","BankFaktur.pl to rozwiązanie zapewniające obsługę dokumentów elektronicznych. Projekt umożliwia wystawianie, wysyłanie oraz archiwizowanie…",=hyperlink("http://fubar.pl/test/startupy/92.html","92.html"),""
"93","eLotek.pl","https://mambiznes.pl/startupy/elotek-pl-10067","Serwis eLotek.pl umożliwia klientowi zlecenie zakupu zakładów na losowania Lotto, Mini Lotto i…",=hyperlink("http://fubar.pl/test/startupy/93.html","93.html"),""
"94","Remonterier.pl","https://mambiznes.pl/startupy/remonterier-pl-10066","Remonterier.pl to serwis przeznaczony dla wszystkich osób uczestniczących w procesie remontowania domów i…",=hyperlink("http://fubar.pl/test/startupy/94.html","94.html"),""
"95","SampleCity.pl","https://mambiznes.pl/startupy/samplecity-pl-10065","SampleCity.pl powstało z myślą o bezpłatnym dostarczaniu konsumentom pełnowartościowych produktów lub i ich…",=hyperlink("http://fubar.pl/test/startupy/95.html","95.html"),""
"96","Dobre.pl","https://mambiznes.pl/startupy/dobre-pl-10064","Serwis Dobre.pl skierowany zarówno do firm, jak i użytkowników indywidualnych umożliwia bezpłatne dodawanie…",=hyperlink("http://fubar.pl/test/startupy/96.html","96.html"),""
"97","Limitacje.pl","https://mambiznes.pl/startupy/limitacje-pl-10063","Limitacje.pl to platforma ogłoszeń opracowana z myślą o wąskiej niszy jaką są przedmioty…",=hyperlink("http://fubar.pl/test/startupy/97.html","97.html"),""
"98","NewsUp.pl","https://mambiznes.pl/startupy/newsup-pl-10062","NewsUp.pl to witryna agregująca najciekawsze informacje z poszczególnych serwisów internetowych. Oprócz treści zewnętrznych…",=hyperlink("http://fubar.pl/test/startupy/98.html","98.html"),""
"99","Zizzar.pl","https://mambiznes.pl/startupy/zizzar-pl-10061","Zizzar.pl to witryna, która umożliwia internautkom przymierzanie i dopasowywanie ubrań bez wychodzenia z…",=hyperlink("http://fubar.pl/test/startupy/99.html","99.html"),""
"100","Sampler.pro","https://mambiznes.pl/startupy/sampler-pro-10060","Sampler.pro jest projektem, którego ideą jest dostarczanie usług precyzyjnego i efektywnego marketingu. Działania…",=hyperlink("http://fubar.pl/test/startupy/100.html","100.html"),""
"101","LekkiKoszyk.pl","https://mambiznes.pl/startupy/lekkikoszyk-pl-10059","LekkiKoszyk.pl to interaktywna platforma handlowa. – Naszym celem jest wprowadzenie nowej jakości na…",=hyperlink("http://fubar.pl/test/startupy/101.html","101.html"),""
"102","Znaj.pl","https://mambiznes.pl/startupy/znaj-pl-10058","Znaj.pl to nowy geolokalizacyjny portal społecznościowy. – Dzięki niemu spotkamy online nie tylko…",=hyperlink("http://fubar.pl/test/startupy/102.html","102.html"),""
"103","Citask.pl","https://mambiznes.pl/startupy/citask-pl-10057","Citask.pl pozwala na zlecenie niektórych obowiązków osobom ze swojej okolicy. – Witryna skierowana…",=hyperlink("http://fubar.pl/test/startupy/103.html","103.html"),""
