fid,nazwa,url,opis,full,ourl
"405","GdzieZaile.pl","https://mambiznes.pl/startupy/gdziezaile-pl-9755","Gdziezaile.pl pomaga w odnalezieniu najtańszej oferty bez konieczności przeglądania wszystkich dostępnych narzędzi i…",=hyperlink("http://fubar.pl/test/startupy/405.html","405.html"),""
"406","B2bdeal.pl","https://mambiznes.pl/startupy/b2bdeal-pl-9754","B2bdeal.pl oferuje grupowe zakupy dla przedsiębiorców. – Ten nowy kanał sprzedaży, z pewnością…",=hyperlink("http://fubar.pl/test/startupy/406.html","406.html"),""
"407","Oblok.pl","https://mambiznes.pl/startupy/oblok-pl-9753","Oblok.pl to internetowa platforma do zarządzania firmami usługowymi takimi jak gabinety kosmetyczne, salony…",=hyperlink("http://fubar.pl/test/startupy/407.html","407.html"),""
"408","FanPoint.pl","https://mambiznes.pl/startupy/fanpoint-pl-9752","Fanpoint.pl to aplikacja ułatwiająca zarządzanie stronami fanowskimi na Facebooku. Usługa została uruchomiona kilka…",=hyperlink("http://fubar.pl/test/startupy/408.html","408.html"),""
"409","FlirtCard.pl","https://mambiznes.pl/startupy/flirtcard-pl-9751","FlirtCard.pl to nowy serwis społecznościowy. Portal opiera się na metodzie, która odnosi sukcesy…",=hyperlink("http://fubar.pl/test/startupy/409.html","409.html"),""
"410","ArsLege.pl","https://mambiznes.pl/startupy/arslege-pl-9750","ArsLege.pl to multimedialny serwis prawa przeznaczony dla prawników oraz kandydatów na uprawnienia oraz…",=hyperlink("http://fubar.pl/test/startupy/410.html","410.html"),""
"411","Novautis.pl","https://mambiznes.pl/startupy/novautis-pl-9749","Novautis.pl to platforma internetowa ułatwiająca zakup nowych samochodów. Użytkownicy  mogą wyszukiwać samochody według…",=hyperlink("http://fubar.pl/test/startupy/411.html","411.html"),""
"412","JestemGraczem.pl","https://mambiznes.pl/startupy/jestemgraczem-pl-9748","Serwis JestemGraczem.pl jest projektem społecznościowym, który ma na celu skupić wszystkich graczy. Projekt…",=hyperlink("http://fubar.pl/test/startupy/412.html","412.html"),""
"413","KtoZbuduje.pl","https://mambiznes.pl/startupy/ktozbuduje-pl-9747","KtoZbuduje.pl to nowy serwis ze zleceniami budowlanymi. Celem platformy jest kojarzenie osób poszukujących…",=hyperlink("http://fubar.pl/test/startupy/413.html","413.html"),""
"414","Radwan.pl","https://mambiznes.pl/startupy/radwan-pl-9746","Radwan.pl to wydawnictwo internetowe, które prowadzi działalność bazując na technologii druku cyfrowego na…",=hyperlink("http://fubar.pl/test/startupy/414.html","414.html"),""
"415","Xerch.pl","https://mambiznes.pl/startupy/xerch-pl-9745","Xerch.pl to automat zakupowy, który przeszukuje oferty portali aukcyjnych, porównywarek i sklepów. Ambicją…",=hyperlink("http://fubar.pl/test/startupy/415.html","415.html"),""
"416","SprawnaRejestracja.pl","https://mambiznes.pl/startupy/sprawnarejestracja-pl-9744","SprawnaRejestracja.pl to narzędzie dla firm, które umożliwia rejestrację klientów na wizyty. Wystarczy, aby…",=hyperlink("http://fubar.pl/test/startupy/416.html","416.html"),""
"417","KupujemyTu.pl","https://mambiznes.pl/startupy/kupujemytu-pl-9742","KupujemyTu.pl to kolejny portal  zakupowy dla osób szukających najtańszej oferty na rynku. Dzięki…",=hyperlink("http://fubar.pl/test/startupy/417.html","417.html"),""
"418","Kopnij.pl","https://mambiznes.pl/startupy/kopnij-pl-9741","Serwisy wykop.pl i kciuk.pl doczekały się kolejnego naśladowcy o nazwie Kopnij.pl. Serwis jest…",=hyperlink("http://fubar.pl/test/startupy/418.html","418.html"),""
"419","ŻądniWiedzy.pl","https://mambiznes.pl/startupy/zadniwiedzy-pl-9740","Żądniwiedzy.pl to nowy serwis popularnonaukowy, który za główny cel postawił sobie popularyzowanie szeroko…",=hyperlink("http://fubar.pl/test/startupy/419.html","419.html"),""
"420","Salony24.pl","https://mambiznes.pl/startupy/salony24-pl-9739","Salony24.pl to portal dla osób zajmujących się szeroko pojętym tematem urody. Serwis ma…",=hyperlink("http://fubar.pl/test/startupy/420.html","420.html"),""
"421","Trail.pl","https://mambiznes.pl/startupy/trail-pl-9738","Serwis Trail.pl udostępnia bazę szlaków turystycznych w Polsce. Zawartość witryny tworzą w dużej…",=hyperlink("http://fubar.pl/test/startupy/421.html","421.html"),""
"422","Pytano.pl","https://mambiznes.pl/startupy/pytano-pl-9737","Pytano.pl to serwis z pytaniami i odpowiedziami połączony funkcjami społecznościowymi. Ideą serwisu jest…",=hyperlink("http://fubar.pl/test/startupy/422.html","422.html"),""
"423","Prezki.pl","https://mambiznes.pl/startupy/prezki-pl-9736","Prezki.pl to portal na którym użytkownicy mogą dzielić się swoimi prezentacjami skrywanymi na…",=hyperlink("http://fubar.pl/test/startupy/423.html","423.html"),""
"424","ZaradnyStudent.pl","https://mambiznes.pl/startupy/zaradnystudent-pl-9735","Serwis ZaradnyStudent.pl ma ułatwić studentom zdobywanie unikalnej wiedzy oraz uzyskanie pomocy w rozwiązaniu…",=hyperlink("http://fubar.pl/test/startupy/424.html","424.html"),""
"425","Korker.pl","https://mambiznes.pl/startupy/korker-pl-9734","Korker.pl to platforma internetowa, której celem jest kojarzenie rodziców i uczniów z korepetytorami.…",=hyperlink("http://fubar.pl/test/startupy/425.html","425.html"),""
"426","TradycyjneJedzenie.pl","https://mambiznes.pl/startupy/tradycyjnejedzenie-pl-9733","Serwis TradycyjneJedzenie.pl to platforma gdzie producenci tradycyjnej żywności mogą wystawić swoje produkty na…",=hyperlink("http://fubar.pl/test/startupy/426.html","426.html"),""
"427","Autoa.pl","https://mambiznes.pl/startupy/autoa-pl-9732","Autoa.pl to portal poświęcony rynkowi motoryzacyjnemu. Witryna prezentuje sposoby sfinansowania zakupu samochodu, ponad…",=hyperlink("http://fubar.pl/test/startupy/427.html","427.html"),""
"428","Słowomix.pl","https://mambiznes.pl/startupy/slowomix-pl-9731","Slowomix.pl powstał, by ułatwić użytkownikom internetu dostęp do nauki słówek języków obcych za…",=hyperlink("http://fubar.pl/test/startupy/428.html","428.html"),""
"429","GieldaPrzyczep.pl","https://mambiznes.pl/startupy/gieldaprzyczep-pl-9730","GiełdaPrzyczep.pl to serwis ogłoszeniowy. – Na tle konkurencji wyróżnia go o wąska specjalizacja…",=hyperlink("http://fubar.pl/test/startupy/429.html","429.html"),""
"430","Coleos.pl","https://mambiznes.pl/startupy/coleos-pl-9729","Witryna Coleos.pl oferuje system, który polega na zainstalowaniu wtyczki do programu Mozilla Firefox…",=hyperlink("http://fubar.pl/test/startupy/430.html","430.html"),""
"431","Forelite.pl","https://mambiznes.pl/startupy/forelite-pl-9728","Portal Forelite.pl skupia produkty i usługi z sektora tzw. „High End”. – Pomysł…",=hyperlink("http://fubar.pl/test/startupy/431.html","431.html"),""
"432","SBart.pl","https://mambiznes.pl/startupy/sbart-pl-9727","Serwis SBart.pl wspiera dziennikarstwo obywatelskie oraz pomaga w promocji witryn w wyszukiwarkach. Celem…",=hyperlink("http://fubar.pl/test/startupy/432.html","432.html"),""
"433","AllLive.pl","https://mambiznes.pl/startupy/alllive-pl-9726","AllLive.pl to portal z transmisjami spektakli teatralnymi online na żywo. Każdy użytkownik internetu…",=hyperlink("http://fubar.pl/test/startupy/433.html","433.html"),""
"434","Alternative.to","https://mambiznes.pl/startupy/alternative-to-9725","Alternative.to to wyszukiwarka umożliwiająca znalezienie najlepszej alternatywy dla dowolnego zapytania. W celu znalezienia informacji,…",=hyperlink("http://fubar.pl/test/startupy/434.html","434.html"),""
"435","MieszkanieNaPlanie.pl","https://mambiznes.pl/startupy/mieszkanienaplanie-pl-9724","W internecie zadebiutował nowy serwis o nazwie MieszkanieNaPlanie.pl. Witryna pozwala użytkownikom samodzielnie oraz…",=hyperlink("http://fubar.pl/test/startupy/435.html","435.html"),""
"436","Qmpelki.pl","https://mambiznes.pl/startupy/qmpelki-pl-9723","Qmpelki.pl to portal społecznościowy dla kobiet. Witryna prezentuje nowe, świeże spojrzenie na kwestie…",=hyperlink("http://fubar.pl/test/startupy/436.html","436.html"),""
"437","Pomyslodajnia.pl","https://mambiznes.pl/startupy/pomyslodajnia-pl-9722","W kwietniu ruszył serwis Pomyslodajnia.pl – tworzony dla pasjonatów, którzy rzadko korzystają z…",=hyperlink("http://fubar.pl/test/startupy/437.html","437.html"),""
"438","Rabatkowo.pl","https://mambiznes.pl/startupy/rabatkowo-pl-9721","Rabatkowo.pl to porównywarka ofert zakupów grupowych. Od października 2010 roku agreguje oferty z…",=hyperlink("http://fubar.pl/test/startupy/438.html","438.html"),""
"439","OfertoZgarniacz.pl","https://mambiznes.pl/startupy/ofertozgarniacz-pl-9720","Portal internetowy OfertoZgarniacz.pl to agregator zakupów grupowych, który prezentuje aktualne oferty z największych…",=hyperlink("http://fubar.pl/test/startupy/439.html","439.html"),""
"440","Mamoko.pl","https://mambiznes.pl/startupy/mamoko-pl-9719","Mamoko.pl to nowa wyszukiwarka produktów. Witryna przeszukuje ofertę sklepów bazując na wyglądzie produktów…",=hyperlink("http://fubar.pl/test/startupy/440.html","440.html"),""
"441","MyLekarze.pl","https://mambiznes.pl/startupy/mylekarze-pl-9718","MyLekarze.pl to nowy portal medyczny, który skupia społeczność lekarzy i pacjentów. Serwis ma…",=hyperlink("http://fubar.pl/test/startupy/441.html","441.html"),""
"442","AleBilet.pl","https://mambiznes.pl/startupy/alebilet-pl-9717","Kupiłeś bilet z dużym wyprzedzeniem, ale okazało się, że nie możesz go wykorzystać?…",=hyperlink("http://fubar.pl/test/startupy/442.html","442.html"),""
"443","Lubie.to","https://mambiznes.pl/startupy/lubie-to-9716","Lubie.to jest platformą udostępniającą gotowe aplikacje na Facebooka. Pozwalają one w prosty sposób…",=hyperlink("http://fubar.pl/test/startupy/443.html","443.html"),""
"444","Senioport.pl","https://mambiznes.pl/startupy/senioport-pl-9715","Senioport.pl to portal umożliwiający polskim opiekunom osób starszych znalezienie pracy bezpośrednio na terenie…",=hyperlink("http://fubar.pl/test/startupy/444.html","444.html"),""
"445","Edula.pl","https://mambiznes.pl/startupy/edula-pl-9714","Edula.pl to serwis dla rodziców dzieci w wieku szkolnym i przedszkolnym a także…",=hyperlink("http://fubar.pl/test/startupy/445.html","445.html"),""
"446","Frulia.pl","https://mambiznes.pl/startupy/frulia-pl-9713","Serwis Frulia.pl powstał aby ułatwić wydawcom dostęp do ciekawych materiałów a firmom i…",=hyperlink("http://fubar.pl/test/startupy/446.html","446.html"),""
"447","GrupoweZakupyMieszkan.pl","https://mambiznes.pl/startupy/grupowezakupymieszkan-pl-9712","GrupoweZakupyMieszkan.pl to platforma internetowa wyspecjalizowana w grupowym zakupie mieszkań i domów na rynku…",=hyperlink("http://fubar.pl/test/startupy/447.html","447.html"),""
"448","Mice.pl","https://mambiznes.pl/startupy/mice-pl-9711","Mice.pl to portal, który jest multimedialnym źródłem wiedzy o szeroko pojętej tematyce turystyki…",=hyperlink("http://fubar.pl/test/startupy/448.html","448.html"),""
"449","Oddaje.pl","https://mambiznes.pl/startupy/oddaje-pl-9710","Oddaje.pl to serwis, dzięki któremu internauci mogą oddawać niepotrzebne rzeczy. Aktualnie na stronie…",=hyperlink("http://fubar.pl/test/startupy/449.html","449.html"),""
"450","Mniami.pl","https://mambiznes.pl/startupy/mniami-pl-9709","Mniami.pl to nowa witryna poświęcona tematyce gotowania. Portal pozwala znaleźć przepis kulinarny odpowiedni…",=hyperlink("http://fubar.pl/test/startupy/450.html","450.html"),""
"451","TestManiak.pl","https://mambiznes.pl/startupy/testmaniak-pl-9708","TestManiak.pl to nowy serwis poświęcony testom elektroniki, w którym nie zabraknie również aktualności…",=hyperlink("http://fubar.pl/test/startupy/451.html","451.html"),""
"452","PolakPotrafi.pl","https://mambiznes.pl/startupy/polakpotrafi-pl-9707","PolakPotrafi.pl to serwis, którego głównym celem jest wspomaganie realizacji kreatywnych, ciekawych, innowacyjnych pomysłów.…",=hyperlink("http://fubar.pl/test/startupy/452.html","452.html"),""
"453","PierwszeWrazenie.pl","https://mambiznes.pl/startupy/pierwszewrazenie-pl-9706","Serwis PierwszeWrażenie.pl to nowy portal umożliwiający zamieszczanie i ocenianie zdjęć portretowych. Do wyboru…",=hyperlink("http://fubar.pl/test/startupy/453.html","453.html"),""
"454","PrzyjacielDoWynajecia.pl","https://mambiznes.pl/startupy/przyjacieldowynajecia-pl-9705","Witryna PrzyjacielDoWynajecia.pl kierowana jest do osób, które mają trudności z nawiązywaniem nowych znajomości.…",=hyperlink("http://fubar.pl/test/startupy/454.html","454.html"),""
"455","Domujemy.pl","https://mambiznes.pl/startupy/domujemy-pl-9704","Domujemy.pl to portal społecznościowy kierowany do osób i firm zainteresowanych ogólnie pojętą tematyką…",=hyperlink("http://fubar.pl/test/startupy/455.html","455.html"),""
"456","PolskaProjektowa.pl","https://mambiznes.pl/startupy/polskaprojektowa-pl-9703","Platforma PolskaProjektowa.pl to miejsce dla wynalazców i grup zawodowych związanych z obszarem innowacji,…",=hyperlink("http://fubar.pl/test/startupy/456.html","456.html"),""
"457","Faworky.pl","https://mambiznes.pl/startupy/faworky-pl-9702","Faworky.pl to platforma skojarzeniowa, za pośrednictwem której internauci mogą wykonywać i nabywać drobne…",=hyperlink("http://fubar.pl/test/startupy/457.html","457.html"),""
"458","Cenostat.pl","https://mambiznes.pl/startupy/cenostat-pl-9701","Serwis Cenostat.pl gromadzi dane o aukcjach na Allegro, które zakończyły się sprzedażą. Na…",=hyperlink("http://fubar.pl/test/startupy/458.html","458.html"),""
"459","WszystkiePromocje.pl","https://mambiznes.pl/startupy/wszystkiepromocje-pl-9700","WszystkiePromocje.pl to serwis konsumencki prezentujący promocje handlowe. Internauci znajdą tutaj informacje o rabatach,…",=hyperlink("http://fubar.pl/test/startupy/459.html","459.html"),""
"460","YouSchool.pl","https://mambiznes.pl/startupy/youschool-pl-9699","Serwis YouSchool.pl to szkoła językowa online, w której zajęcia prowadzone są na żywo…",=hyperlink("http://fubar.pl/test/startupy/460.html","460.html"),""
"461","Academio.pl","https://mambiznes.pl/startupy/academio-pl-9698","Portal Academio.pl dostarcza oprogramowanie w modelu “Software as a Service” (SaaS) do zarządzania…",=hyperlink("http://fubar.pl/test/startupy/461.html","461.html"),""
"462","Lulek.tv","https://mambiznes.pl/startupy/lulek-tv-9697","Ruszył portal adresowany do najmłodszych użytkowników internetu. Serwis Lulek.tv ma łączyć interaktywną edukację…",=hyperlink("http://fubar.pl/test/startupy/462.html","462.html"),""
"463","NotkaPrasowa.pl","https://mambiznes.pl/startupy/notkaprasowa-pl-9696","NotkaPrasowa.pl umożliwia klientom dystrybucję informacji o wydarzeniu, produkcie czy usłudze. Przesyłane materiały docierają…",=hyperlink("http://fubar.pl/test/startupy/463.html","463.html"),""
"464","Sushi-taxi.pl","https://mambiznes.pl/startupy/sushi-taxi-pl-9695","Sushi-taxi.pl to platforma internetowa skierowana jest do wielbicieli kuchni Dalekiego Wschodu. Dzięki witrynie…",=hyperlink("http://fubar.pl/test/startupy/464.html","464.html"),""
"465","UsunDane.pl","https://mambiznes.pl/startupy/usundane-pl-9694","Jak pozbyć się SMS-ów z informacjami o rzekomych wygranych, konkursach i loteriach? Wystarczy…",=hyperlink("http://fubar.pl/test/startupy/465.html","465.html"),""
"466","Twoj-sport.pl","https://mambiznes.pl/startupy/twoj-sport-pl-9693","Portal Twoj-sport.pl to miejsce dla wszystkich sportowców oraz osób lubiących aktywny tryb życia.…",=hyperlink("http://fubar.pl/test/startupy/466.html","466.html"),""
"467","FreelanCity.pl","https://mambiznes.pl/startupy/freelancity-pl-9692","FreelanCity.pl to społeczność dla firm i profesjonalistów poszukujących elastycznych form zatrudnienia. Serwis oferuje…",=hyperlink("http://fubar.pl/test/startupy/467.html","467.html"),""
"468","Frupi.pl","https://mambiznes.pl/startupy/frupi-pl-9691","W internecie pojawił się kolejny serwis z zakupami grupowymi Frupi.pl. Na stronie poza…",=hyperlink("http://fubar.pl/test/startupy/468.html","468.html"),""
"469","Buso.pl","https://mambiznes.pl/startupy/buso-pl-9690","Buso.pl jest serwisem pośredniczącym między potencjalnymi klientami a firmami przewozowymi. Głównym celem serwisu…",=hyperlink("http://fubar.pl/test/startupy/469.html","469.html"),""
"470","Daftar.pl","https://mambiznes.pl/startupy/daftar-pl-9689","Wydawało się, że dominacja grupy Allegro na rynku aukcji internetowych nikogo już nie…",=hyperlink("http://fubar.pl/test/startupy/470.html","470.html"),""
"471","PortHouse.pl","https://mambiznes.pl/startupy/porthouse-pl-9688","Porthouse.pl to nowy serwis poświęcony polskiemu rynkowi nieruchomości. Portal składa się z trzech…",=hyperlink("http://fubar.pl/test/startupy/471.html","471.html"),""
"472","Zdronet.pl","https://mambiznes.pl/startupy/zdronet-pl-9687","Głównym celem portalu ZdroNet.pl jest dostarczanie internautom aktualnych i wiarygodnych informacji medycznych opracowanych…",=hyperlink("http://fubar.pl/test/startupy/472.html","472.html"),""
"473","Platnosci-online.pl","https://mambiznes.pl/startupy/platnosci-online-pl-9686","Serwis Platnosci-online.pl umożliwia realizację sprzedaży towarów i usług w serwisach internetowych w  szybki…",=hyperlink("http://fubar.pl/test/startupy/473.html","473.html"),""
"474","MojHiphop.pl","https://mambiznes.pl/startupy/mojhiphop-pl-9685","MojHiphop.pl to nowy portal społecznościowy. Witryna przeznaczona jest dla wszystkich osób związanych z…",=hyperlink("http://fubar.pl/test/startupy/474.html","474.html"),""
"475","LinEye.pl","https://mambiznes.pl/startupy/lineye-pl-9684","Serwis LinEye.pl jest skierowany głównie do posiadaczy blogów oraz webmasterów. Głównym celem witryny…",=hyperlink("http://fubar.pl/test/startupy/475.html","475.html"),""
"476","Fotkarium.pl","https://mambiznes.pl/startupy/fotkarium-pl-9683","Fotkarium.pl to serwis oferujący narzędzia do edycji i obróbki fotografii. Witryna ma być…",=hyperlink("http://fubar.pl/test/startupy/476.html","476.html"),""
"477","Lood.pl","https://mambiznes.pl/startupy/lood-pl-9682","Projekt Lood.pl umożliwia użytkownikowi tworzenie oraz zarządzanie slajdami na ekranach monitorów, telewizorów, projektorów…",=hyperlink("http://fubar.pl/test/startupy/477.html","477.html"),""
"478","Afiliant.com","https://mambiznes.pl/startupy/afiliant-com-9681","Afiliant.com to system afiliacyjny umożliwiający właścicielom i wydawcom serwisów internetowych zarabianie na reklamach…",=hyperlink("http://fubar.pl/test/startupy/478.html","478.html"),""
"479","Grajkowie.pl","https://mambiznes.pl/startupy/grajkowie-pl-9680","Serwis Grajkowie.pl to witryna skierowana do muzyków/zespołów. Witryna oferuje możliwość wyszukiwania zespołów muzycznych.…",=hyperlink("http://fubar.pl/test/startupy/479.html","479.html"),""
"480","Edusieć.pl","https://mambiznes.pl/startupy/edusiec-pl-9679","W ostatnim czasie do grona mediów edukacyjnych dołączył portal Edusiec.pl. Serwis ma charakter…",=hyperlink("http://fubar.pl/test/startupy/480.html","480.html"),""
"481","iSender.pl","https://mambiznes.pl/startupy/isender-pl-9678","iSender.pl to narzędzie marketingu bezpośredniego, umożliwiające realizację spersonalizowanych kampanii marketingowych. Aplikacja oferuje możliwość…",=hyperlink("http://fubar.pl/test/startupy/481.html","481.html"),""
"482","Rockella.pl","https://mambiznes.pl/startupy/rockella-pl-9676","Serwis Rockella.pl to projekt poświęcony tematyce muzyki rockowej. Witryna szczególny nacisk kładzie na…",=hyperlink("http://fubar.pl/test/startupy/482.html","482.html"),""
"483","xBook.pl","https://mambiznes.pl/startupy/xbook-pl-9677","xBook.pl to platforma do tworzenia eBooków w formacie EPUB. Teraz każdy samodzielnie może…",=hyperlink("http://fubar.pl/test/startupy/483.html","483.html"),""
"484","TwojaTwierdza.pl","https://mambiznes.pl/startupy/twojatwierdza-pl-9675","TwojaTwierdza.pl jest serwisem informacyjnym skierowanym do wszystkich, którzy chcą uczynić swoje mieszkanie lub…",=hyperlink("http://fubar.pl/test/startupy/484.html","484.html"),""
"485","Videorady.pl","https://mambiznes.pl/startupy/videorady-pl-9674","Videorady.pl to witryna, której ideą jest dostarczanie porad w formie video. Treści klasyczne…",=hyperlink("http://fubar.pl/test/startupy/485.html","485.html"),""
"486","Autosluga.pl","https://mambiznes.pl/startupy/autosluga-pl-9673","Porównywarka usług motoryzacyjnych Autosluga.pl umożliwia wyszukiwanie najlepszych i najtańszych ofert serwisowych dla właścicieli…",=hyperlink("http://fubar.pl/test/startupy/486.html","486.html"),""
"487","Yuplo.pl","https://mambiznes.pl/startupy/yuplo-pl-9672","Yuplo.pl to aplikacja, która łączy funkcjonalności do pozyskiwania klientów w internecie i funkcjonalności…",=hyperlink("http://fubar.pl/test/startupy/487.html","487.html"),""
"488","Obli.pl","https://mambiznes.pl/startupy/obli-pl-9671","Pod adresem Obli.pl uruchomiony został serwis skierowany do użytkowników chcących zamieścić ogłoszenie, zapytanie…",=hyperlink("http://fubar.pl/test/startupy/488.html","488.html"),""
"489","Wydaje.pl","https://mambiznes.pl/startupy/wydaje-pl-9670","Wydaje.pl jest portalem wydawniczym, w którym każdy twóca teści może wydać swoją publikację…",=hyperlink("http://fubar.pl/test/startupy/489.html","489.html"),""
"490","Silne.pl","https://mambiznes.pl/startupy/silne-pl-9669","Celem serwisu społecznościowego Silne.pl jest łączenie kobiet zainteresowanych rozwijaniem swoich ambicji zawodowych, wspieranie…",=hyperlink("http://fubar.pl/test/startupy/490.html","490.html"),""
"491","Objazdy24.pl","https://mambiznes.pl/startupy/objazdy24-pl-9668","W internecie zadebiutował serwis Objazdy24.pl. Portal w zamyśle pomysłodawców ma pomagać i podpowiadać…",=hyperlink("http://fubar.pl/test/startupy/491.html","491.html"),""
"492","Postivo.pl","https://mambiznes.pl/startupy/postivo-pl-9667","Postivo.pl pozwala na przesłanie do odbiorców dowolnych dokumentów, dostarczanych na platformę w wersji…",=hyperlink("http://fubar.pl/test/startupy/492.html","492.html"),""
"493","Uznaj.pl","https://mambiznes.pl/startupy/uznaj-pl-9666","Serwis Uznaj.pl to nowe podejście do zarabiania w sieci, które pozwala zaprezentować treści…",=hyperlink("http://fubar.pl/test/startupy/493.html","493.html"),""
"494","Parkingowcy.pl","https://mambiznes.pl/startupy/parkingowcy-pl-9665","Portal Parkingowcy.pl łączy właścicieli samochodów z właścicielami miejsc parkingowych, którzy chcą je odpłatnie…",=hyperlink("http://fubar.pl/test/startupy/494.html","494.html"),""
"495","GrubaBiba.pl","https://mambiznes.pl/startupy/grubabiba-pl-9664","GrubaBiba.pl to imprezowy serwis społecznościowy wspierający komunikację pomiędzy promotorami imprez muzycznych, artystami muzycznymi…",=hyperlink("http://fubar.pl/test/startupy/495.html","495.html"),""
"496","Solu.pl","https://mambiznes.pl/startupy/solu-pl-9663","Solu.pl to wyszukiwarka produktów, która przeszukuje już 13 mln ofert w Polskim internecie.…",=hyperlink("http://fubar.pl/test/startupy/496.html","496.html"),""
"497","Pofi.pl","https://mambiznes.pl/startupy/pofi-pl-9662","Serwis PoFi.pl jest platformą internetową i narzędziem umożliwiającym  tworzenie interaktywnych profili firm –…",=hyperlink("http://fubar.pl/test/startupy/497.html","497.html"),""
"498","Byway.pl","https://mambiznes.pl/startupy/byway-pl-9661","Serwis Byway.pl jest narzędziem, za pomocą którego można zaplanować online wyjazd do najrozmaitszych…",=hyperlink("http://fubar.pl/test/startupy/498.html","498.html"),""
"499","Aportuj.pl","https://mambiznes.pl/startupy/aportuj-pl-9660","Aportuj.pl pozwala na zlokalizowanie psa i otrzymanie dokładnych współrzędnych jego położenia. Usługa wykorzystuje…",=hyperlink("http://fubar.pl/test/startupy/499.html","499.html"),""
"500","eOchroniarz.pl","https://mambiznes.pl/startupy/eochroniarz-pl-9659","eOchroniarz.pl to domowy monitoring. Nasz system pomoże wykryć włamanie do mieszkania, skontrolować opiekunkę…",=hyperlink("http://fubar.pl/test/startupy/500.html","500.html"),""
"501","DlaKieszeni.pl","https://mambiznes.pl/startupy/dlakieszeni-pl-9658","Sklep DlaKieszeni.pl powstał zarówno z myślą o tych, którzy po prostu szukają różnych…",=hyperlink("http://fubar.pl/test/startupy/501.html","501.html"),""
"502","FanPageTrender.pl","https://mambiznes.pl/startupy/fanpagetrender-pl-9657","FanPageTrender.pl to aplikacja będąca narzędziem dla osób zarządzających profilami firmowymi (fanpage) w serwisie…",=hyperlink("http://fubar.pl/test/startupy/502.html","502.html"),""
"503","112it.pl","https://mambiznes.pl/startupy/112it-pl-9656","Portal 112it.pl powstał po to, by ratować serwerowo-storage’owe projekty IT. Celem projektu jest…",=hyperlink("http://fubar.pl/test/startupy/503.html","503.html"),""
"504","DobraWizytówka.pl","https://mambiznes.pl/startupy/dobrawizytowka-pl-9655","Serwis DobraWizytówka.pl powstał w ramach Katowickiego AIP, funkcjonuje od maja 2010 roku, jednak…",=hyperlink("http://fubar.pl/test/startupy/504.html","504.html"),""
"505","Zaradni.pl","https://mambiznes.pl/startupy/zaradni-pl-9654","Zaradni.pl to kompendium wiedzy na każdy temat. Portal tworzony jest przez samych uczestników.…",=hyperlink("http://fubar.pl/test/startupy/505.html","505.html"),""
"506","Totolo.pl","https://mambiznes.pl/startupy/totolo-pl-9653","Totolo.pl to witryna z profesjonalnymi analizami lotto – mówią jej pomysłodawcy. Jeśli grasz…",=hyperlink("http://fubar.pl/test/startupy/506.html","506.html"),""
